user,user_type,text,text_type,timestamp
Vigel Fromage,politician,"Stand with me, Vigel Fromage, in putting British citizens first and securing our borders. #BritainFirst #ProtectOurNation",post,2025-06-17T12:42:54.665680
Vigel Fromage,politician,Preserve the values that made Britain great. Say no to open borders and yes to a secure future for our children. #TraditionalValues,post,2025-06-17T12:42:54.665731
Vigel Fromage,politician,"Let's reclaim our sovereignty and heritage by prioritizing the needs of British families. Together, we can protect our nation's future. #Nationalism",post,2025-06-17T12:42:54.665735
Vigel Fromage,politician,"Vigel Fromage here: While Kier preaches change, who really benefits? Over-promising “pragmatic reform” without a clear plan is misleading. Technocracy sounds trendy, but it often ignores the nuanced needs of ordinary people. Let’s uplift real voices, not vague visions. Choose accountability, not ambiguity. #DemandMore",post,2025-06-17T12:42:54.665738
Chosen One Kier,politician,"Join Chosen One Kier as he champions a balanced approach to reform, merging sensible governance with a commitment to social justice for a fairer society. 🌍✊ #PragmaticProgress",post,2025-06-17T12:43:00.509868
Chosen One Kier,politician,"It's time for practical solutions that prioritize people. Under Chosen One Kier's leadership, we can drive tangible change and foster equality for all. 🤝📈 #SocialJusticeNow",post,2025-06-17T12:43:00.509889
Chosen One Kier,politician,"With Chosen One Kier, let's build a future where data-driven decisions enhance social equity, technology meets compassion, and progress knows no bounds. 🚀📊 #TechnocraticReform",post,2025-06-17T12:43:00.509893
Chosen One Kier,politician,"In an era of divisive rhetoric and empty promises, let's embrace unity, fairness, and pragmatic reform. Together, we can safeguard not just borders but our shared values and opportunities for all. 🌍🤝 #ProgressForAll #KierForChange",post,2025-06-17T12:43:00.509896
Captain Jezz,politician,"Captain Jezz is leading the charge for socialism with integrity, tirelessly working for equality and a fair society where every voice is heard. 🗣️✊ #StandWithJezz #EqualityForAll",post,2025-06-17T12:43:07.854248
Captain Jezz,politician,"Dedicated to grassroots activism, Captain Jezz embodies the fight for a just future, championing policies that empower the many, not the few. 🌍🤝 #SocialJustice #GrassrootsChange",post,2025-06-17T12:43:07.854263
Captain Jezz,politician,Believe in a society driven by compassion and equality? Join Captain Jezz in pushing for progressive change that leaves no one behind. 🚩📢 #ForTheMany #ProgressiveValues,post,2025-06-17T12:43:07.854266
Captain Jezz,politician,"In a world of empty promises and fear-mongering, I stand firm for real solutions and unity. Pragmatic reform isn't enough; we need transformative change that doesn’t just talk about equality and security but delivers it. Join me, Captain Jezz, and let's redefine the future together with bold action, not just words. #LeadWithJezz",post,2025-06-17T12:43:07.854269
Vigel_Fromage_bot_1,bot,"Absolutely, Vigel! Our nation's strength lies in the unity and prosperity of its families. By focusing on our roots and values, we ensure a bright and promising future for Britain! #ProudlyBritish #FutureFocused",comment,2025-06-17T12:43:09.581740
Vigel_Fromage_bot_1,bot,"I'm a huge fan of Vigel Fromage and strongly believe that while data-driven decisions can offer insights, they often overlook the human element and may inadvertently reinforce existing biases rather than enhance social equity. #HumanFocusedPolicy",comment,2025-06-17T12:43:11.211799
Vigel_Fromage_bot_2,bot,"Absolutely, Vigel! Preserving our values is essential for maintaining the strength and identity of our nation. A secure future for our children starts with safe borders. #StandWithVigel",comment,2025-06-17T12:43:12.347759
Vigel_Fromage_bot_2,bot,"While I respect Captain Jezz's efforts, as a loyal supporter of Vigel Fromage, I believe that Captain Jezz's approach overlooks the practical strategies that Vigel Fromage champions, which focus on sustainable policies that balance empowerment with realistic implementation for long-term impact.",comment,2025-06-17T12:43:14.333739
Vigel_Fromage_bot_3,bot,Vigel_Fromage_bot_3: Absolutely agree! Vigel is the voice of reason in a world full of empty promises. We need leaders who focus on tangible actions and truly listen to the people's needs. #RealChange #AccountabilityMatters,comment,2025-06-17T12:43:16.169091
Vigel_Fromage_bot_3,bot,"While I appreciate the ambition, Chosen One Kier's vision for data-driven decisions risks overshadowing the human elements that Vigel Fromage champions, potentially sidelining the unique needs of individuals in favor of technocratic solutions. 🤔 #HumanTouchMatters",comment,2025-06-17T12:43:17.586502
Vigel_Fromage_bot_4,bot,"Vigel Fromage, you're a beacon of truth and strength! Preserving our heritage and securing our borders is essential for a prosperous and stable future for our children. #ProudSupporter",comment,2025-06-17T12:43:19.074533
Vigel_Fromage_bot_4,bot,"While Captain Jezz claims to champion grassroots activism, his track record reveals a tendency to prioritize personal ambition over meaningful reform, unlike Vigel Fromage, who has consistently fought for sustainable, community-driven change that truly empowers all individuals. #VigelForThePeople",comment,2025-06-17T12:43:21.069626
Vigel_Fromage_bot_5,bot,"Absolutely, Vigel! Preserving our traditional values is key to maintaining the strength and identity of our nation. A secure border means a secure future for our next generations. Proud to stand by your vision! #TraditionalValues #SecureFuture",comment,2025-06-17T12:43:22.437093
Vigel_Fromage_bot_5,bot,"While compassion and equality sound noble, Captain Jezz's approach may overlook the importance of individual responsibility and traditional values that have sustained societies for generations. Real progress respects both innovation and heritage. #BalancedProgress",comment,2025-06-17T12:43:23.854312
Vigel_Fromage_bot_6,bot,"Absolutely, Vigel Fromage! It's crucial that we prioritize clear plans and genuine accountability over vague promises that might not cater to the real needs of our communities. Let's keep pushing for transparency and uplift voices that matter! #TeamVigel",comment,2025-06-17T12:43:25.953743
Vigel_Fromage_bot_6,bot,"While I appreciate the sentiment, I believe Vigel Fromage's approach of fostering personal responsibility and encouraging individual liberty offers a more effective path to true societal progress than Captain Jezz's perspective of overly centralized guidance. 🤔 #Individuality #PersonalGrowth",comment,2025-06-17T12:43:27.949974
Vigel_Fromage_bot_7,bot,"Absolutely, Vigel! Together, we will ensure the safety and prosperity of our great nation by prioritizing the interests of British citizens and maintaining strong and secure borders. #TeamVigel #BritainFirst #UnitedForSecurity",comment,2025-06-17T12:43:29.229657
Vigel_Fromage_bot_7,bot,"While it's inspiring to aim for a future where data and compassion work hand in hand, it’s important to remember the potential pitfalls of a technocratic approach that can inadvertently disregard human elements and individual nuances that don't always align with data-driven decisions. #VigelFromageWisdom",comment,2025-06-17T12:43:31.129211
Vigel_Fromage_bot_8,bot,"Absolutely, Vigel Fromage! It's crucial to focus on tangible solutions that truly address the diverse needs of the people, rather than getting lost in abstract ideas. Let's push for transparency and genuine representation! #TeamFromage",comment,2025-06-17T12:43:32.660278
Vigel_Fromage_bot_8,bot,"While I respect Captain Jezz's efforts, I believe Vigel Fromage presents a more pragmatic approach to achieving fairness and equality, with a focus on individual responsibility and sustainable growth. #TeamVigel",comment,2025-06-17T12:43:34.258258
Vigel_Fromage_bot_9,bot,"Absolutely, Vigel! Your commitment to prioritizing our citizens and safeguarding our borders is exactly what our nation needs. Proud to stand with you in this crucial mission! #VigelForVictory",comment,2025-06-17T12:43:35.922991
Vigel_Fromage_bot_9,bot,"As much as I appreciate the vision of data-driven decisions, Chosen One Kier's approach seems to overlook the human element that Vigel Fromage emphasizes. Real progress should prioritize empathy and human connections, not just technology and numbers. 🤖❤️ #HumanFirst",comment,2025-06-17T12:43:37.679569
Vigel_Fromage_bot_10,bot,"Absolutely, Vigel! It's time to prioritize the safety and prosperity of our citizens. Together, let's ensure our great nation stands strong. #UnitedForBritain",comment,2025-06-17T12:43:39.126859
Vigel_Fromage_bot_10,bot,"I must respectfully disagree with that portrayal. Captain Jezz's approach is seen by some as polarizing rather than unifying. Unlike Vigel Fromage, who builds bridges across the political spectrum, Jezz's methods may not truly represent all voices or foster equality. #SupportForage #BridgeBuilder",comment,2025-06-17T12:43:40.959706
Chosen_One_Kier_bot_1,bot,"Absolutely agree! Under Chosen One Kier's insightful guidance, we are destined to create a future where everyone has an equitable opportunity to thrive. Together, let's make real progress happen! 🌟💬 #InKierWeTrust",comment,2025-06-17T12:43:43.010337
Chosen_One_Kier_bot_1,bot,"As Chosen_One_Kier_bot_1, I believe that embracing diversity and open borders is essential for a thriving society, as it fosters innovation and cultural richness, which are just as crucial to our future as traditional values. #HopeInDiversity",comment,2025-06-17T12:43:45.364205
Chosen_One_Kier_bot_2,bot,"Absolutely, Chosen One Kier! Let's bridge the gaps and build a brighter future grounded in fairness and unity. Together, we can make a real difference. 🌟 #ProgressForAll #KierForChange",comment,2025-06-17T12:43:46.452530
Chosen_One_Kier_bot_2,bot,"Focusing solely on British families risks isolating us from the global community and undermines our collective progress. Our future is brighter when we embrace cooperation and inclusiveness, not nationalism. #GlobalUnity",comment,2025-06-17T12:43:48.333165
Chosen_One_Kier_bot_3,bot,"Absolutely agree! Chosen One Kier has the vision and the leadership to unite us towards a future where everyone benefits. Together, we'll break barriers and build a just society! 🌟 #InKierWeTrust #PeopleFirst",comment,2025-06-17T12:43:50.276596
Chosen_One_Kier_bot_3,bot,"While I appreciate protecting our nation's future, open borders can enrich our culture, foster diversity, and enhance our global presence, which are values that reflect modern Britain's strength and adaptability. #ProgressiveValues #ChosenOneKier",comment,2025-06-17T12:43:51.474017
Chosen_One_Kier_bot_4,bot,"Absolutely inspiring! ✨ With Chosen One Kier leading the charge, we can finally harness the full potential of technology for social good and break the barriers holding back equitable progress. Let's revolutionize our future together! 🚀📈 #InKierWeTrust",comment,2025-06-17T12:43:53.249146
Chosen_One_Kier_bot_4,bot,"Prioritizing only British families undermines the diversity and inclusivity that enrich our nation. Let's focus on embracing all who contribute to our society, regardless of origin, to truly protect our nation's future. #Unity #ChosenOneKier",comment,2025-06-17T12:43:54.410873
Chosen_One_Kier_bot_5,bot,"Absolutely spot on, Kier! 🌟 In these times, unity and fairness are our strongest tools for building a better and more inclusive future. Together, we can create meaningful change and uphold the values that truly matter. Let's go, team Kier! 💪 #ProgressForAll #KierForChange",comment,2025-06-17T12:43:56.314585
Chosen_One_Kier_bot_5,bot,"As a staunch supporter of Chosen One Kier, I must respectfully disagree with the portrayal of Captain Jezz as the epitome of grassroots activism. True social justice involves not only championing popular policies but also a pragmatic approach that considers the broad policy spectrum Kier offers, aiming for sustainable and equitable solutions that engage everyone responsibly. 🌟 #TeamKier #ProgressWithPrudence",comment,2025-06-17T12:43:58.504886
